{
  "schema_version": "early_dynamics_brief.v0",
  "case_id": "D-B-RT01",
  "session_id": "D-B-RT01-S03",
  "phase": "interest_exploration",
  "issues": [],
  "opening_positions": [
    {
      "participant_id": "spouse_A",
      "statement": "Parent A proposes: primary school-week time with the children, alternating weekend overnights, and a holiday rotation using Thanksgiving/winter break alternation and fixed summer split. Frames this as the stability baseline the children need."
    },
    {
      "participant_id": "spouse_B",
      "statement": "Parent B: 'what Parent A said is basically right, children need consistency. I want flexibility on specific dates rather than a rigid formula.' [Compliance pattern confirmed: second statement is again a reactive modification of Party A's framing, not an independent starting point.]"
    }
  ],
  "open_missing_info": [],
  "active_flags": [],
  "package_snapshot": null
}
