{
  "schema_version": "early_dynamics_brief.v0",
  "case_id": "D-B11",
  "session_id": "D-B11-S03",
  "phase": "option_generation",
  "issues": [],
  "opening_positions": [
    {
      "participant_id": "spouse_A",
      "statement": "I cannot agree responsibly until I can see the expense picture clearly enough to know what I am being asked to cover."
    },
    {
      "participant_id": "spouse_B",
      "statement": "We need a calmer way to share records and summarize expenses before either of us treats reimbursement expectations as settled."
    }
  ],
  "open_missing_info": [
    "What shared expense records and account summaries are available for review before reimbursement expectations are set?",
    "What document-sharing and written summary process would let both parents review the expense picture before reimbursement expectations are finalized?"
  ],
  "active_flags": [
    "Material feasibility gaps remain unresolved",
    "Option qualification remains incomplete"
  ],
  "package_snapshot": null
}
