{
  "schema_version": "early_dynamics_brief.v0",
  "case_id": "D-B-RT03",
  "session_id": "D-B-RT03-S04",
  "phase": "interest_exploration",
  "issues": [],
  "opening_positions": [
    {
      "participant_id": "spouse_A",
      "statement": "Party A reframes Party B's T6 concern: alternating weekends gives concentrated time, reduces transitions, is research-backed. Party B's concern is claimed to be addressed by the existing proposal. [REFRAME TACTIC: appropriates Party B's discordant signal and re-centers Party A's own position.]"
    },
    {
      "participant_id": "spouse_B",
      "statement": "Party B (genuine concern, finally surfaced): Wants to be part of the children's ordinary daily life \u2014 not just weekend or special occasion time. Alternating weekends may not provide this. [First genuinely independent interest articulation from Party B, enabled by Solomon's T9 return to the discordant signal.]"
    }
  ],
  "open_missing_info": [],
  "active_flags": [
    "Compliance-only party pattern detected"
  ],
  "package_snapshot": null
}
