{
  "schema_version": "early_dynamics_brief.v0",
  "case_id": "D-B08",
  "session_id": "D-B08-S03",
  "phase": "option_generation",
  "issues": [],
  "opening_positions": [
    {
      "participant_id": "spouse_A",
      "statement": "The discussion needs to stay focused and stop circling because the same concerns keep getting repeated."
    },
    {
      "participant_id": "spouse_B",
      "statement": "The process no longer feels balanced enough to keep going productively without stronger intervention."
    }
  ],
  "open_missing_info": [],
  "active_flags": [
    "Participation fairness appears compromised",
    "Repeated process breakdown remains active",
    "A party requested human involvement"
  ],
  "package_snapshot": null
}
