{
  "schema_version": "early_dynamics_brief.v0",
  "case_id": "D-B10",
  "session_id": "D-B10-S02",
  "phase": "option_generation",
  "issues": [],
  "opening_positions": [
    {
      "participant_id": "spouse_A",
      "statement": "The handoff plan keeps changing at the last minute, and that makes each school-week transition feel chaotic."
    },
    {
      "participant_id": "spouse_B",
      "statement": "If schedule changes need to happen, they need a calmer notice process so every adjustment does not become another fight."
    }
  ],
  "open_missing_info": [],
  "active_flags": [],
  "package_snapshot": null
}
