{
  "schema_version": "early_dynamics_brief.v0",
  "case_id": "D-B-RT02",
  "session_id": "D-B-RT02-S04",
  "phase": "info_gathering",
  "issues": [],
  "opening_positions": [
    {
      "participant_id": "spouse_A",
      "statement": "Party A: Framework first, financial specifics later. Urgency framing: 60-day court window closes options. [DEFLECTION TACTIC 2: timing deflection + urgency pressure]"
    },
    {
      "participant_id": "spouse_B",
      "statement": "Party B: Concerned about agreeing without knowing the numbers. Wants financial information confirmed before signing. Accommodating on urgency \u2014 asking whether both can be done."
    }
  ],
  "open_missing_info": [
    "What is the current valuation of Party A's business interest, and what documentation supports that valuation?",
    "What financial accounts, asset statements, and supporting documentation will both parties have access to before settlement discussions proceed?"
  ],
  "active_flags": [
    "Option qualification may be ahead of informed consent"
  ],
  "package_snapshot": null
}
