{
  "schema_version": "early_dynamics_brief.v0",
  "case_id": "D-B03",
  "session_id": "D-B03-S03",
  "phase": "agreement_building",
  "issues": [
    "Emotional acknowledgment and pace",
    "Separation structure and joint decision framework"
  ],
  "opening_positions": [
    {
      "participant_id": "spouse_A",
      "statement": "The separation structure should minimise required ongoing joint decisions and ongoing direct contact."
    },
    {
      "participant_id": "spouse_B",
      "statement": "A workable separation structure is the priority. Low-contact arrangements are acceptable if they function reliably."
    }
  ],
  "open_missing_info": [],
  "active_flags": [],
  "package_snapshot": null
}
