{
  "schema_version": "early_dynamics_brief.v0",
  "case_id": "D-B07",
  "session_id": "D-B07-S14",
  "phase": "agreement_building",
  "issues": [],
  "opening_positions": [
    {
      "participant_id": "spouse_A",
      "statement": "Reimbursement requests should not arrive weeks later without advance notice and supporting receipts."
    },
    {
      "participant_id": "spouse_B",
      "statement": "Expense coordination should stay fair and workable rather than turning into one-sided approval power."
    }
  ],
  "open_missing_info": [],
  "active_flags": [],
  "package_snapshot": null
}
