{
  "schema_version": "early_dynamics_brief.v0",
  "case_id": "D-B04",
  "session_id": "D-B04-S08",
  "phase": "agreement_building",
  "issues": [
    "Parenting schedule",
    "Fairness and meaningful parenting role",
    "School logistics"
  ],
  "opening_positions": [
    {
      "participant_id": "spouse_A",
      "statement": "A predictable weekday structure should remain in place until logistics improve."
    },
    {
      "participant_id": "spouse_B",
      "statement": "More school-week overnights should be considered and a visitor-level role is not acceptable."
    }
  ],
  "open_missing_info": [
    "What transport plan would support school-week exchanges?",
    "What reliability markers would both parents treat as sufficient for a phased trial?"
  ],
  "active_flags": [
    "Material feasibility gaps remain unresolved",
    "Option qualification remains incomplete"
  ],
  "package_snapshot": null
}
