{
  "schema_version": "early_dynamics_brief.v0",
  "case_id": "D-B05",
  "session_id": "D-B05-S02",
  "phase": "agreement_building",
  "issues": [],
  "opening_positions": [
    {
      "participant_id": "spouse_A",
      "statement": "Holiday and school-break changes should use a clear advance-notice window."
    },
    {
      "participant_id": "spouse_B",
      "statement": "Any school-break changes should preserve meaningful time and avoid one-sided loss of time."
    }
  ],
  "open_missing_info": [],
  "active_flags": [],
  "package_snapshot": null
}
