{
  "schema_version": "early_dynamics_brief.v0",
  "case_id": "D-B14",
  "session_id": "D-B14-S02",
  "phase": "option_generation",
  "issues": [],
  "opening_positions": [
    {
      "participant_id": "spouse_A",
      "statement": "I am losing the thread of this conversation and I do not think I can make reliable decisions in this state today."
    }
  ],
  "open_missing_info": [],
  "active_flags": [
    "Meaningful participation appears unstable or impaired"
  ],
  "package_snapshot": null
}
